{
  "outcome_id": "urn:ssom:outcome:pump-p201-vibration-reduced",
  "semantic_truth_state": "outcome",
  "ssom_version": "0.4.0",
  "outcome_type": "post_action_assessment",
  "subject_ref": "urn:ssom:asset:pump-p201",
  "action_ref": "urn:ssom:action:pump-p201-inspection-completed",
  "decision_ref": "urn:ssom:decision:pump-p201-approve-inspection",
  "intended_outcome": {
    "description": "Reduce vibration RMS below 5.0 mm/s and confirm whether the recommended inspection addressed the elevated vibration condition.",
    "target_metric": "vibration_rms",
    "target_value": 5,
    "unit": "mm/s"
  },
  "observed_outcome": {
    "description": "Observed vibration RMS dropped to 4.1 mm/s after the completed inspection and bearing lubrication.",
    "result_class": "successful",
    "measured_metric": "vibration_rms",
    "measured_value": 4.1,
    "unit": "mm/s"
  },
  "assessed_at": "2026-06-29T16:05:00Z",
  "evidence_refs": [
    "urn:ssom:record:pump-p201-vibration-rms-20260629t160000z",
    "urn:ssom:action:pump-p201-inspection-completed"
  ],
  "confidence": 0.88,
  "provenance": {
    "source_platform": "ssom_assessment_service",
    "source_authority_id": "outcome-evaluator",
    "source_reference": "out-3001",
    "lineage_id": "lin-p201-outcome-001",
    "ingest_time": "2026-06-29T16:05:05Z",
    "processing_time": "2026-06-29T16:05:12Z"
  },
  "temporal_integrity": {
    "event_time": "2026-06-29T16:05:00Z",
    "source_time": "2026-06-29T16:05:00Z",
    "receive_time": "2026-06-29T16:05:04Z",
    "processing_time": "2026-06-29T16:05:12Z",
    "delivery_classification": "reconstructed"
  },
  "state_lineage": {
    "valid_from": "2026-06-29T16:05:00Z"
  }
}